[{"_id":"aefaaaaaaabf2a33abbckalhycg6lhaaaaaq","OriginatingAgency":"RATP","TotalObjects":{"ingested":4.0,"deleted":0.0,"remained":4.0},"TotalObjectGroups":{"ingested":3.0,"deleted":0.0,"remained":3.0},"TotalUnits":{"ingested":6.0,"deleted":0.0,"remained":6.0},"ObjectSize":{"ingested":18.0,"deleted":0.0,"remained":18.0},"CreationDate":"2018-12-18T09:03:04.092","_v":1,"_tenant":0}]